{
  "protocol_version": "0.1",
  "message_type": "command.request",
  "message_id": "msg_01COMMAND",
  "correlation_id": "corr_0001",
  "device_id": "dev_demo",
  "session_id": "ses_demo",
  "connection_id": "conn_demo",
  "sequence": 12,
  "sent_at": "2026-10-02T05:31:00Z",
  "deadline_at": "2026-10-02T05:32:00Z",
  "payload": {
    "command_id": "cmd_demo",
    "idempotency_key": "idem_demo_0001",
    "operation": "process.start",
    "arguments": {
      "command": "mvn test",
      "cwd": "C:\\\\workspace\\\\demo"
    },
    "requested_permissions": [
      "SHELL_SAFE"
    ],
    "risk": "MEDIUM",
    "workspace_id": "ws_demo",
    "approval_id": null
  }
}
